"No.","Time","Source","Destination","Protocol","Length","Info"
"1","0.000000000","Cisco_d4:1c:03","Cisco_d4:1c:03","LOOP","60","Reply"
"2","0.426736305","172.16.40.1","172.16.1.1","DNS","81","Standard query 0x3c31 AAAA tux41.netlab.fe.up.pt"
"3","0.428216705","172.16.1.1","172.16.40.1","DNS","141","Standard query response 0x3c31 AAAA tux41.netlab.fe.up.pt SOA ns.netlab.fe.up.pt"
"4","0.428299123","172.16.40.1","172.16.1.1","DNS","65","Standard query 0x5ada AAAA tux41"
"5","0.429403032","172.16.1.1","172.16.40.1","DNS","140","Standard query response 0x5ada No such name AAAA tux41 SOA a.root-servers.net"
"6","0.452717999","Cisco_d4:1c:03","Spanning-tree-(for-bridges)_00","STP","60","Conf. Root = 32768/40/30:37:a6:d4:1c:00  Cost = 0  Port = 0x8003"
"7","0.635161258","172.16.40.1","172.16.1.1","DNS","81","Standard query 0x9801 AAAA tux41.netlab.fe.up.pt"
"8","0.636487338","172.16.1.1","172.16.40.1","DNS","141","Standard query response 0x9801 AAAA tux41.netlab.fe.up.pt SOA ns.netlab.fe.up.pt"
"9","0.636568769","172.16.40.1","172.16.1.1","DNS","65","Standard query 0xde60 AAAA tux41"
"10","0.637735011","172.16.1.1","172.16.40.1","DNS","140","Standard query response 0xde60 No such name AAAA tux41 SOA a.root-servers.net"
"11","2.457456393","Cisco_d4:1c:03","Spanning-tree-(for-bridges)_00","STP","60","Conf. Root = 32768/40/30:37:a6:d4:1c:00  Cost = 0  Port = 0x8003"
"12","4.462298459","Cisco_d4:1c:03","Spanning-tree-(for-bridges)_00","STP","60","Conf. Root = 32768/40/30:37:a6:d4:1c:00  Cost = 0  Port = 0x8003"
"13","5.439490349","G-ProCom_8c:af:af","HewlettP_5a:7b:ea","ARP","42","Who has 172.16.40.254? Tell 172.16.40.1"
"14","5.439838393","HewlettP_5a:7b:ea","G-ProCom_8c:af:af","ARP","60","172.16.40.254 is at 00:21:5a:5a:7b:ea"
"15","5.616946039","HewlettP_5a:7b:ea","G-ProCom_8c:af:af","ARP","60","Who has 172.16.40.1? Tell 172.16.40.254"
"16","5.616971252","G-ProCom_8c:af:af","HewlettP_5a:7b:ea","ARP","42","172.16.40.1 is at 00:0f:fe:8c:af:af"
"17","6.467367525","Cisco_d4:1c:03","Spanning-tree-(for-bridges)_00","STP","60","Conf. Root = 32768/40/30:37:a6:d4:1c:00  Cost = 0  Port = 0x8003"
"18","8.472043839","Cisco_d4:1c:03","Spanning-tree-(for-bridges)_00","STP","60","Conf. Root = 32768/40/30:37:a6:d4:1c:00  Cost = 0  Port = 0x8003"
"19","9.508792060","172.16.40.1","172.16.1.1","DNS","69","Standard query 0x7f49 A ftp.up.pt"
"20","9.510508804","172.16.1.1","172.16.40.1","DNS","355","Standard query response 0x7f49 A ftp.up.pt CNAME mirrors.up.pt A 193.137.29.15 NS ns4.up.pt NS ns1.up.pt NS ns2.up.pt NS ns3.up.pt A 193.137.55.30 AAAA 2001:690:2200:a10::30 A 193.137.55.31 AAAA 2001:690:2200:a10::31 A 193.137.55.32 AAAA 2001:690:2200:a10::32 A 193.137.55.33 AAAA 2001:690:2200:a10::33"
"21","9.510653946","172.16.40.1","193.137.29.15","TCP","74","60735  >  21 [SYN] Seq=0 Win=29200 Len=0 MSS=1460 SACK_PERM=1 TSval=1466577 TSecr=0 WS=128"
"22","9.514130102","193.137.29.15","172.16.40.1","TCP","74","21  >  60735 [SYN, ACK] Seq=0 Ack=1 Win=28960 Len=0 MSS=1380 SACK_PERM=1 TSval=798857767 TSecr=1466577 WS=128"
"23","9.514155487","172.16.40.1","193.137.29.15","TCP","66","60735  >  21 [ACK] Seq=1 Ack=1 Win=29312 Len=0 TSval=1466578 TSecr=798857767"
"24","9.519709118","193.137.29.15","172.16.40.1","FTP","139","Response: 220-Welcome to the University of Porto's mirror archive (mirrors.up.pt)"
"25","9.519724117","193.137.29.15","172.16.40.1","FTP","135","Response: 220----------------------------------------------------------------"
"26","9.519727856","193.137.29.15","172.16.40.1","FTP","72","Response: 220-"
"27","9.519755331","172.16.40.1","193.137.29.15","TCP","66","60735  >  21 [ACK] Seq=1 Ack=74 Win=29312 Len=0 TSval=1466580 TSecr=798857768"
"28","9.519767051","172.16.40.1","193.137.29.15","TCP","66","60735  >  21 [ACK] Seq=1 Ack=143 Win=29312 Len=0 TSval=1466580 TSecr=798857768"
"29","9.519772229","172.16.40.1","193.137.29.15","TCP","66","60735  >  21 [ACK] Seq=1 Ack=149 Win=29312 Len=0 TSval=1466580 TSecr=798857768"
"30","9.520628891","193.137.29.15","172.16.40.1","FTP","151","Response: 220-All connections and transfers are logged. The max number of connections is 200."
"31","9.520639994","193.137.29.15","172.16.40.1","FTP","72","Response: 220-"
"32","9.520643082","193.137.29.15","172.16.40.1","FTP","140","Response: 220-For more information please visit our website: http://mirrors.up.pt/"
"33","9.520660516","172.16.40.1","193.137.29.15","TCP","66","60735  >  21 [ACK] Seq=1 Ack=234 Win=29312 Len=0 TSval=1466580 TSecr=798857768"
"34","9.520669184","172.16.40.1","193.137.29.15","TCP","66","60735  >  21 [ACK] Seq=1 Ack=240 Win=29312 Len=0 TSval=1466580 TSecr=798857768"
"35","9.520674126","172.16.40.1","193.137.29.15","TCP","66","60735  >  21 [ACK] Seq=1 Ack=314 Win=29312 Len=0 TSval=1466580 TSecr=798857768"
"36","9.520911476","193.137.29.15","172.16.40.1","FTP","127","Response: 220-Questions and comments can be sent to mirrors@uporto.pt"
"37","9.520920328","172.16.40.1","193.137.29.15","TCP","66","60735  >  21 [ACK] Seq=1 Ack=375 Win=29312 Len=0 TSval=1466580 TSecr=798857768"
"38","9.520924930","193.137.29.15","172.16.40.1","FTP","72","Response: 220-"
"39","9.520929436","172.16.40.1","193.137.29.15","TCP","66","60735  >  21 [ACK] Seq=1 Ack=381 Win=29312 Len=0 TSval=1466580 TSecr=798857768"
"40","9.520933176","193.137.29.15","172.16.40.1","FTP","72","Response: 220-"
"41","9.520937467","172.16.40.1","193.137.29.15","TCP","66","60735  >  21 [ACK] Seq=1 Ack=387 Win=29312 Len=0 TSval=1466580 TSecr=798857768"
"42","9.520941497","193.137.29.15","172.16.40.1","FTP","72","Response: 220 "
"43","9.520945708","172.16.40.1","193.137.29.15","TCP","66","60735  >  21 [ACK] Seq=1 Ack=393 Win=29312 Len=0 TSval=1466580 TSecr=798857768"
"44","9.521722637","172.16.40.1","193.137.29.15","FTP","71","Request: user "
"45","9.523924477","193.137.29.15","172.16.40.1","TCP","66","21  >  60735 [ACK] Seq=393 Ack=6 Win=29056 Len=0 TSval=798857769 TSecr=1466580"
"46","9.523947069","172.16.40.1","193.137.29.15","FTP","76","Request: anonymous"
"47","9.525833540","193.137.29.15","172.16.40.1","TCP","66","21  >  60735 [ACK] Seq=393 Ack=16 Win=29056 Len=0 TSval=798857770 TSecr=1466581"
"48","9.525856704","193.137.29.15","172.16.40.1","FTP","100","Response: 331 Please specify the password."
"49","9.527607783","172.16.40.1","193.137.29.15","FTP","71","Request: pass "
"50","9.576007270","193.137.29.15","172.16.40.1","TCP","66","21  >  60735 [ACK] Seq=427 Ack=21 Win=29056 Len=0 TSval=798857782 TSecr=1466582"
"51","9.576043326","172.16.40.1","193.137.29.15","FTP","71","Request: pass"
"52","9.577978990","193.137.29.15","172.16.40.1","TCP","66","21  >  60735 [ACK] Seq=427 Ack=26 Win=29056 Len=0 TSval=798857783 TSecr=1466594"
"53","9.580781719","193.137.29.15","172.16.40.1","FTP","89","Response: 230 Login successful."
"54","9.580876969","172.16.40.1","193.137.29.15","FTP","71","Request: pasv "
"55","9.611833504","Cisco_d4:1c:03","CDP/VTP/DTP/PAgP/UDLD","CDP","432","Device ID: tux-sw4  Port ID: FastEthernet0/1  "
"56","9.624003253","193.137.29.15","172.16.40.1","TCP","66","21  >  60735 [ACK] Seq=450 Ack=31 Win=29056 Len=0 TSval=798857795 TSecr=1466595"
"57","9.624029875","172.16.40.1","193.137.29.15","FTP","76","Request: anonymous"
"58","9.626546579","193.137.29.15","172.16.40.1","TCP","66","21  >  60735 [ACK] Seq=450 Ack=41 Win=29056 Len=0 TSval=798857795 TSecr=1466606"
"59","9.627309506","193.137.29.15","172.16.40.1","FTP","116","Response: 227 Entering Passive Mode (193,137,29,15,213,6)."
"60","9.627706008","172.16.40.1","193.137.29.15","TCP","74","45402  >  54534 [SYN] Seq=0 Win=29200 Len=0 MSS=1460 SACK_PERM=1 TSval=1466607 TSecr=0 WS=128"
"61","9.630541346","193.137.29.15","172.16.40.1","TCP","74","54534  >  45402 [SYN, ACK] Seq=0 Ack=1 Win=28960 Len=0 MSS=1380 SACK_PERM=1 TSval=798857796 TSecr=1466607 WS=128"
"62","9.630570450","172.16.40.1","193.137.29.15","TCP","66","45402  >  54534 [ACK] Seq=1 Ack=1 Win=29312 Len=0 TSval=1466607 TSecr=798857796"
"63","9.630652442","172.16.40.1","193.137.29.15","FTP","71","Request: retr "
"64","9.675928888","193.137.29.15","172.16.40.1","TCP","66","21  >  60735 [ACK] Seq=500 Ack=46 Win=29056 Len=0 TSval=798857808 TSecr=1466607"
"65","9.675967125","172.16.40.1","193.137.29.15","FTP","80","Request: debian/README"
"66","9.678565223","193.137.29.15","172.16.40.1","TCP","66","21  >  60735 [ACK] Seq=500 Ack=60 Win=29056 Len=0 TSval=798857808 TSecr=1466619"
"67","9.679671177","193.137.29.15","172.16.40.1","FTP","139","Response: 150 Opening BINARY mode data connection for debian/README (1193 bytes)."
"68","9.680531796","193.137.29.15","172.16.40.1","FTP-DATA","1259","FTP Data: 1193 bytes (PASV) (retr )"
"69","9.680545922","193.137.29.15","172.16.40.1","TCP","66","54534  >  45402 [FIN, ACK] Seq=1194 Ack=1 Win=29056 Len=0 TSval=798857809 TSecr=1466607"
"70","9.680563521","172.16.40.1","193.137.29.15","TCP","66","45402  >  54534 [ACK] Seq=1 Ack=1194 Win=32128 Len=0 TSval=1466620 TSecr=798857809"
"71","9.681759372","172.16.40.1","193.137.29.15","TCP","66","45402  >  54534 [FIN, ACK] Seq=1 Ack=1195 Win=32128 Len=0 TSval=1466620 TSecr=798857809"
"72","9.681834602","172.16.40.1","193.137.29.15","TCP","66","60735  >  21 [FIN, ACK] Seq=60 Ack=573 Win=29312 Len=0 TSval=1466620 TSecr=798857808"
"73","9.683611837","193.137.29.15","172.16.40.1","TCP","66","54534  >  45402 [ACK] Seq=1195 Ack=2 Win=29056 Len=0 TSval=798857809 TSecr=1466620"
"74","9.683633928","193.137.29.15","172.16.40.1","FTP","90","Response: 226 Transfer complete."
"75","9.683657101","172.16.40.1","193.137.29.15","TCP","54","60735  >  21 [RST] Seq=60 Win=0 Len=0"
"76","9.684791332","193.137.29.15","172.16.40.1","TCP","66","21  >  60735 [FIN, ACK] Seq=597 Ack=61 Win=29056 Len=0 TSval=798857810 TSecr=1466620"
"77","9.684805743","172.16.40.1","193.137.29.15","TCP","54","60735  >  21 [RST] Seq=61 Win=0 Len=0"
"78","10.007421329","Cisco_d4:1c:03","Cisco_d4:1c:03","LOOP","60","Reply"
"79","10.477045877","Cisco_d4:1c:03","Spanning-tree-(for-bridges)_00","STP","60","Conf. Root = 32768/40/30:37:a6:d4:1c:00  Cost = 0  Port = 0x8003"
"80","12.481865205","Cisco_d4:1c:03","Spanning-tree-(for-bridges)_00","STP","60","Conf. Root = 32768/40/30:37:a6:d4:1c:00  Cost = 0  Port = 0x8003"
"81","14.486724935","Cisco_d4:1c:03","Spanning-tree-(for-bridges)_00","STP","60","Conf. Root = 32768/40/30:37:a6:d4:1c:00  Cost = 0  Port = 0x8003"
"82","16.491738544","Cisco_d4:1c:03","Spanning-tree-(for-bridges)_00","STP","60","Conf. Root = 32768/40/30:37:a6:d4:1c:00  Cost = 0  Port = 0x8003"
